{
  "benchmark_id": "fi-jepa-synthetic-m1",
  "title": "FI-JEPA executable synthetic baseline",
  "task": {
    "target": "Train-normalized synthetic future-block target used by the frozen downstream probe",
    "horizon": "Strictly later target block after a past-only context block",
    "primary_question": "Can latent prediction on deterministic synthetic regime-switching panels produce features useful to a frozen downstream probe?",
    "failure_condition": "No promotion beyond M1/E1 without the real-data, stronger-baseline, multi-seed and uncertainty gates documented in the project registry."
  },
  "data": {
    "source": "Deterministic synthetic regime-switching market panels generated by FI-JEPA",
    "license": "Repository license",
    "version": "M1/E1 synthetic fixture",
    "hash": "generated-deterministically-from-code-and-seed",
    "point_in_time": true,
    "availability_time_notes": "Context observations strictly precede target observations; no future sample may enter fitting or normalization.",
    "universe_notes": "Synthetic fixture only; no claim about historical asset-universe reconstruction."
  },
  "splits": {
    "policy": "chronological",
    "description": "Chronological train/validation split with no shared observations.",
    "embargo": "Implicit non-overlap from fixture construction; verify from implementation before any promotion.",
    "protected_test_locked": true
  },
  "baselines": [
    {
      "name": "persistence",
      "role": "trivial",
      "frozen_before_test": true,
      "notes": "Current implemented comparator from the FI-JEPA synthetic baseline."
    },
    {
      "name": "frozen-ridge-probe",
      "role": "domain",
      "frozen_before_test": true,
      "notes": "Frozen downstream probe used to evaluate learned representation utility."
    }
  ],
  "metrics": [
    {
      "name": "probe_error",
      "primary": true,
      "uncertainty_method": "Not yet sufficient for promotion; multiple seeds and confidence intervals are required at the next gate."
    },
    {
      "name": "above_training_mean_classification_accuracy",
      "primary": false,
      "uncertainty_method": "Synthetic auxiliary metric; explicitly not raw return-direction accuracy."
    }
  ],
  "transaction_costs": null,
  "leakage_controls": [
    "All context observations precede all target observations",
    "Chronological splits share no observations",
    "No future sample may enter fitting or normalization",
    "Synthetic results must not be presented as realized returns or alpha"
  ],
  "reproducibility": {
    "commit_sha": "bind-to-exact-main-sha-at-execution",
    "config": "python -m fi_jepa.cli --epochs 40",
    "environment_lock": "FI-JEPA/pyproject.toml",
    "exact_command": "python -m pip install -e 'FI-JEPA[dev]' && pytest -q FI-JEPA/tests && python -m fi_jepa.cli --epochs 40",
    "raw_outputs_retained": false,
    "artifact_path": "No retained raw result artifact yet; CLI currently prints JSON."
  },
  "result_status": "UNTESTED",
  "release_decision": "CONTINUE",
  "claims": [
    {
      "claim": "FI-JEPA is an executable deterministic synthetic baseline.",
      "allowed": true,
      "evidence": "FI-JEPA implementation, tests, CLI and README."
    },
    {
      "claim": "FI-JEPA demonstrates real-market alpha or profitability.",
      "allowed": false,
      "evidence": "No licensed point-in-time real-market evaluation exists."
    },
    {
      "claim": "FI-JEPA is superior to strong financial baselines.",
      "allowed": false,
      "evidence": "Required stronger baselines, multiple seeds and confidence intervals are not yet complete."
    }
  ]
}
